{
  "schema_version": 1,
  "id": "text/index-nested",
  "reference": {
    "project": "go",
    "revision": "go1.27.0",
    "source": "src/text/template/funcs.go",
    "behavior": "Index applies each index to the result of the preceding lookup.",
    "derived": true
  },
  "request": {
    "engine": "text",
    "name": "index-nested",
    "template": "{{index . \"outer\" 1 \"name\"}}",
    "data": {"outer": [{"name": "zero"}, {"name": "one"}]},
    "function_profile": "none"
  },
  "expected": {
    "output": "one",
    "error": null
  }
}
