{
  "schema_version": 1,
  "id": "text/missing-key-default",
  "reference": {
    "project": "go",
    "revision": "go1.27.0",
    "source": "src/text/template/option.go",
    "behavior": "The default missing-key mode renders an invalid mapping value.",
    "derived": true
  },
  "request": {
    "engine": "text",
    "name": "missing-default",
    "template": "before/{{.missing}}/after",
    "data": {},
    "options": ["missingkey=default"],
    "function_profile": "none"
  },
  "expected": {
    "output": "before/<no value>/after",
    "error": null
  }
}
